<?xml version="1.0" encoding="UTF-8"?>
<!-- XML Sample Message of message hierarchy                                          -->
<!-- Message:             Get Installed Base Response v1.1                            -->
<!-- Transaction:         IB - Installed Base                                         -->
<!-- Datamodel:           ZSmart Communication Datamodel, version 1.0                 -->
<!-- XML tagset used:     KpnML                                                       -->
<!-- Generated at:        08-12-2016 17:32:05                                         -->
<!-- Generated using:     EC-Design 1.6.1* (http://www.ec-design.nl)                  -->
<!-- Generated by:        Frans van Basten                                            -->
<!-- Organisation:        KPN (KPN)                                                   -->
<!-- NOTE:    This sample message was generated automatically: manual modifications will be lost -->
<GetInstalledBaseResponse-v1 xsi:schemaLocation="http://services.kpn.com/Messages/GetInstalledBaseResponse-v1 GetInstalledBaseResponse-v1.1.xsd"
		xmlns="http://services.kpn.com/Messages/GetInstalledBaseResponse-v1"
		xmlns:xsi="http://www.w3.org/2001/XMLSchema-instance">
	<OrigReqerId>ORIGREQID0H7G6F7B234C8A</OrigReqerId>
	<Cust>
		<CustId>CustomerID123456</CustId>
		<Prod>
			<ProdCd>PROD007</ProdCd>
			<ComName>Instant telephony</ComName>
			<InstId>PRODUCTINST123321</InstId>
			<ProdRelParent>
				<ProdCd>PROD007</ProdCd>
				<InstId>PRODUCTINST123321</InstId>
			</ProdRelParent>
			<Attr>
				<AttrCd>E001</AttrCd>
				<AttrVal>elated</AttrVal>
			</Attr>
			<Cfs>
				<CfsCd>SRV4005</CfsCd>
				<ComName>Instant telephony</ComName>
				<InstId>PRODUCTINST123321</InstId>
				<CfsInstStat>ACTIVE</CfsInstStat>
				<CfsRelParent>
					<CfsCd>SRV4005</CfsCd>
					<InstId>PRODUCTINST123321</InstId>
				</CfsRelParent>
				<Attr>
					<AttrCd>E002</AttrCd>
					<AttrVal>eloquent</AttrVal>
				</Attr>
				<Rfs>
					<RfsCd>RFSCODE001</RfsCd>
					<ComName>Instant telephony</ComName>
					<InstId>PRODUCTINST123321</InstId>
					<Attr>
						<AttrCd>E003</AttrCd>
						<AttrVal>embezzle</AttrVal>
					</Attr>
				</Rfs>
			</Cfs>
		</Prod>
	</Cust>
</GetInstalledBaseResponse-v1>